name,latitude,longitude,description,type,status
Smith Ltd,-7.01494575214122,-41.588558703661,Act quality success beyond land take speech. Wait theory whether property lead worry.,ROOFTOP_BAR,ACTIVE
"White, Sanchez and Young",-7.097622,-41.467229,The article when look night spring. Foreign remain sister finally prepare test return.,COCKTAIL_BAR,ACTIVE
Taylor Ltd,-7.009532,-42.126209,Particularly get thing while major. Executive already choose great kind best spring road.,WINERY,ACTIVE
Brooks-Ruiz,-7.854889,-41.908345,Available represent market truth eat. Reason pick will easy idea. Hotel remember American threat.,WINERY,ACTIVE
"Williams, Johnson and Lawrence",-7.56408772483063,-40.7187974452972,Listen teacher star question. Threat wear land nothing. Administration better assume sense.,FOOD_TRUCK,ACTIVE
"Martin, Cooper and Underwood",-7.35557,-41.141586,Admit modern particularly animal. Cut hit draw space pay so staff.,CAFE,ACTIVE
Jackson Inc,-7.13372278135568,-41.0291075706482,Plan again participant book. High prove own police bed law sell.,NIGHTCLUB,ACTIVE
"Noble, Manning and Miller",-7.423839,-40.691174,One peace main pressure into share. Argue hotel someone. Character interview standard power.,SPORTS_BAR,ACTIVE
"Holloway, Williamson and Ellison",-7.438711,-40.671823,Simple election defense agency according forget itself. Fine various listen notice perform either season. Series body provide voice cause company walk data.,COCKTAIL_BAR,ACTIVE
"Sharp, Brown and Sellers",-7.302051,-40.499943,Same color technology usually life. Safe fire reach people result. Eat public those forward material.,BREWERY,ACTIVE
Robinson PLC,-7.088893,-40.606474,Note them century eye financial role along. Matter speak such once moment edge truth century.,PUB,ACTIVE
Rhodes Inc,-7.073741,-40.375641,Range American property. Tax mouth build audience century. Step speak work fund.,NIGHTCLUB,ACTIVE
"Ford, Reynolds and Whitney",-7.283056,-40.456669,Moment story get weight left hospital. Turn loss opportunity firm want quality race ever.,WINERY,ACTIVE
"Taylor, Anthony and Olson",-7.092,-40.025265,Describe fight that show ball. Find wrong compare fire section agency may. Apply town piece threat dark listen.,COCKTAIL_BAR,ACTIVE
"Archer, Dunn and Dillon",-7.210765,-40.137098,Safe service right. Rate each unit home factor station full own.,SPORTS_BAR,ACTIVE
Gomez LLC,-7.5768,-40.503723,Than subject billion top shoulder. Dark simple southern people result dream despite.,COCKTAIL_BAR,ACTIVE
"Ross, Tate and Clark",-8.000163,-40.625031,Option way night movement certain participant. Which campaign recent pay rather charge individual. Heavy create tend concern and.,LOUNGE,ACTIVE
Salinas Inc,-7.891275,-40.060341,Laugh must loss him training since. Financial feeling watch night lead relationship almost. Idea idea but provide piece eight military have.,ROOFTOP_BAR,ACTIVE
"Lynn, Ponce and Gill",-8.057813,-39.135384,Occur trip large set model quality force. Always whose full care.,COCKTAIL_BAR,ACTIVE
Lawrence-Mckinney,-7.82774,-39.084347,Public owner pick month skin value lay. Example be at material.,SPORTS_BAR,ACTIVE
Jones LLC,-7.496269,-38.980694,Describe indicate both nor class its grow hand. Building class somebody various call rather career. Trouble range Republican be cover.,NIGHTCLUB,ACTIVE
Thompson-Harrison,-7.49243032395893,-38.9849461913764,Score day product very certainly bring music. Contain vote director own section myself throughout left. Manager beyond sign place heavy join.,PUB,ACTIVE
"Johnson, Martin and Kirby",-7.493457,-38.984119,By drop sure. Table you matter natural. Add party way environmental. The student heavy station simple under edge last.,NIGHTCLUB,ACTIVE
"Wong, Coleman and Zimmerman",-7.305417,-38.942028,Difficult network second car. Maybe respond visit several member laugh.,BAR,ACTIVE
Hill-Wright,-7.361498,-39.051235,Under nation strong election message gas. Information approach much decide store. She responsibility ability.,SPORTS_BAR,ACTIVE
"Cook, Mejia and Weber",-7.17975,-39.32539,Per well condition moment kid challenge.,ROOFTOP_BAR,ACTIVE
"Kelley, Williams and Gonzalez",-7.220161,-39.327286,What ready walk always about determine college box. This change everything.,ROOFTOP_BAR,ACTIVE
Harper LLC,-7.23631795957383,-39.4087100028992,Activity little so time north drug sea. Step small short especially long.,RESTAURANT,ACTIVE
"Gutierrez, Newton and Jensen",-7.094549,-39.679452,Everyone quality own pull and. Magazine stage possible billion meeting.,LOUNGE,ACTIVE
"Phillips, Jones and Hanna",-7.0317799646083,-39.3230912089348,Seem least change so. Him ahead true note protect. Money ball these big attack economic. Enough wrong else responsibility.,WINERY,ACTIVE
Bell-Christensen,-6.098614,-39.446843,Security subject rather treatment become clearly cultural. Green yeah key believe across behind. Hard newspaper reduce cell yes.,NIGHTCLUB,ACTIVE
Gordon-Villegas,-6.511598,-39.551323,Write development guess network head. Data hot fall movie defense sort. Change others exactly source interview.,CAFE,ACTIVE
Hoover Group,-6.602465,-39.056591,Value probably vote body necessary include catch. Wish listen expect while. Nearly especially major.,PUB,ACTIVE
Mcdonald-Johnson,-6.372050452048,-39.3027117848396,Team responsibility three radio never. Wall people happy. Possible television happy thing million speech.,SPORTS_BAR,ACTIVE
"Nelson, Solis and Daniels",-6.357998,-39.295536,Mission point reality education yeah. Kid perhaps put defense rest. Evidence less authority south walk. Manage end rich whom born few.,CAFE,ACTIVE
Hughes LLC,-6.191425,-38.89209,Yeah dog reveal. Clear happen game view. Letter manage sound arm right inside tree.,CAFE,ACTIVE
Yoder-Bailey,-6.413892,-38.863136,Story sea activity style and. Idea court beyond respond know. Concern those threat true.,RESTAURANT,ACTIVE
"Johnson, Thomas and Cox",-6.75509944133672,-38.9582531154156,Approach property continue high measure manager. Subject new leave support debate down security single. Wear husband west sure summer teach week around.,SPORTS_BAR,ACTIVE
Gibson PLC,-6.665616,-39.013936,Subject beyond blood no. Occur rate source dinner scientist media. Sign fine risk bag usually become security trip.,CAFE,ACTIVE
"Barton, Jones and Tyler",-6.771475,-38.236439,Shoulder message detail skill main stuff. Mission buy animal coach usually party student.,NIGHTCLUB,ACTIVE
"Kelly, Andersen and Barker",-6.77087162684395,-38.2342430949211,President market religious participant right. Card particular government scene.,NIGHTCLUB,ACTIVE
Bryant-Thompson,-6.903655,-38.563414,Economic unit because. Me cultural pick history.,PUB,ACTIVE
Gould-Jones,-6.891016,-38.551885,Hold director direction. Become TV media since. Body star employee apply. Out physical three rise PM.,FOOD_TRUCK,ACTIVE
Lara and Sons,-6.520711,-38.4128,General role since nation feeling. Election analysis likely already measure fast involve individual. Let agree while century activity.,RESTAURANT,ACTIVE
"Bradley, Scott and Ward",-6.20659841458492,-38.4949180262765,Level step course idea. Land watch present health realize hour back.,NIGHTCLUB,ACTIVE
Hawkins Ltd,-6.910448,-37.600536,Simply wonder leader in. Organization full consumer room protect. View recently thousand strong.,NIGHTCLUB,ACTIVE
"Harris, Lucas and Thompson",-6.772448,-37.796222,Find here drive assume threat field.,COCKTAIL_BAR,ACTIVE
"Carpenter, Johnson and Wright",-7.75062787993677,-37.6383762806654,Drive the adult player. Heart particularly must her card sound little. Work ability show eight reflect.,FOOD_TRUCK,ACTIVE
Shields Ltd,-7.59964464304554,-37.5397554785013,Sit science event past save position those. Recently however someone official writer. Live tree box third high. Receive reason source agency throughout small.,CAFE,ACTIVE
Clark-Robbins,-8.0739917284992,-37.2657938749575,Friend none actually note. Including relate market already ground pass. Field left company amount economy little.,CAFE,ACTIVE
"Dixon, Carter and Wang",-7.478206,-37.274309,Somebody meeting believe rich four. Team personal sure describe thought. Guess question experience exactly entire whom general.,FOOD_TRUCK,ACTIVE
Fry Ltd,-8.007097,-36.059364,Consider force performance economic audience fund. Up just certainly court later. Late big will wide prevent Republican ok.,ROOFTOP_BAR,ACTIVE
Petty PLC,-8.299414,-35.974777,Green ahead prove sense.,PUB,ACTIVE
Torres LLC,-8.28406874920031,-35.98508477211,Shake power class. Few join part which really speak.,RESTAURANT,ACTIVE
"Wallace, Alexander and Kelley",-8.279534,-35.972027,Get any store necessary agreement door water. Pass go college again industry however. Peace or she room.,FOOD_TRUCK,ACTIVE
Marshall Ltd,-8.65918,-35.567326,Enough improve guess hot throw rock. Sell everything full nation animal.,BREWERY,ACTIVE
"Vazquez, Williams and Smith",-8.240685,-35.749748,Science leg teach task. Again face per without consumer threat teacher consider.,LOUNGE,ACTIVE
Hutchinson PLC,-8.11763,-35.297133,Authority training authority approach child reason. Against individual nation stay on. Station between over step.,ROOFTOP_BAR,ACTIVE
Jordan-Mcintyre,-8.504922,-35.374802,Understand like sport kid. Month story happy.,BREWERY,ACTIVE
Anderson-Allen,-8.44001,-35.013629,Necessary always effort. Other around box sure oil far. Capital interview sure group peace effort marriage.,RESTAURANT,ACTIVE
"Hernandez, Alexander and Harris",-8.16318,-34.926126,Over note bill. Blue deep adult why religious husband.,BAR,ACTIVE
Hodges-Yu,-8.271187,-35.024109,Movement challenge information crime trade. Success perhaps give situation. Degree election customer particular example hotel international.,ROOFTOP_BAR,ACTIVE
"Fox, Burch and Simmons",-8.239179,-34.940414,Least talk provide. Growth perhaps provide baby note place everything. Mr community good school father land.,RESTAURANT,ACTIVE
Jackson-Brown,-8.342249,-35.002079,Strong present ready program suddenly something. Industry those pull these.,BREWERY,ACTIVE
"Wilson, Spence and Rice",-8.351858,-34.953802,Image involve my process school try community. Clear quite answer century.,RESTAURANT,ACTIVE
"Brooks, Perez and Benjamin",-8.340719,-34.957516,Enjoy fight information law president full way. Product worker individual actually structure.,PUB,ACTIVE
"Walker, George and Sutton",-8.290273,-35.034371,Edge suggest thus election college smile boy. Effect on middle hard lawyer control office. Total else discussion.,ROOFTOP_BAR,ACTIVE
"George, Smith and Thompson",-8.39919,-35.059696,Score production nor value here help model. Yes stock produce positive wear media friend level.,BAR,ACTIVE
"Harris, Greer and Pena",-7.896735,-35.176212,Guess eight final close nearly when.,LOUNGE,ACTIVE
Campbell Group,-7.920455,-34.929091,Indeed he without center. Agree big cell start. Pay billion likely as itself manager. Shoulder federal management court imagine heavy prepare.,SPORTS_BAR,ACTIVE
"Ferrell, Miller and Barrett",-7.995992,-34.928318,Hotel reality than onto a. Learn mention short contain authority material center.,PUB,ACTIVE
Kelley-Williams,-7.995084,-34.862473,Position ever ability them almost. Nature thank security few. Mother science address line. Time wish attorney camera no walk sea morning.,FOOD_TRUCK,ACTIVE
Bennett-Cohen,-8.057808,-34.890556,Memory nice hold positive box standard. Crime thank kind model and. Whatever in action guy.,RESTAURANT,ACTIVE
Mosley PLC,-8.062745,-34.89505,Challenge enjoy law fight decision perform price. Particular help mind ground soon. Sure form defense mind building.,NIGHTCLUB,ACTIVE
"King, Garcia and Bell",-8.0630375778322,-34.8955721408129,Image candidate will moment education too fast. Technology produce enter likely miss we side.,CAFE,ACTIVE
Davis-Kelly,-8.020628,-34.92073,Cell work ever evening child. It check talk more its ok eye.,PUB,ACTIVE
"Hill, Mathews and Davis",-8.013449,-34.923267,Audience window imagine whom stay affect be. Song start method country whom Congress part. Road speak phone whole.,CAFE,ACTIVE
Fox and Sons,-8.006169,-34.933075,Either consumer voice meeting age seven foreign huge. Tell full outside child last deep base five. Pattern similar coach break more game outside.,BAR,ACTIVE
"Smith, Garcia and Smith",-7.997536,-35.010925,Particular deep fact citizen force. Front certainly relate later. Remain age else strategy account half modern toward.,BAR,ACTIVE
Johnson LLC,-8.104928,-34.978443,Onto high mention all involve ask. Enter wear street girl.,CAFE,ACTIVE
King-Gonzales,-8.114861,-34.907029,Also wind use such share change society. Brother talk win light pattern drive experience gun. International respond success help. Whole reduce across adult.,COCKTAIL_BAR,ACTIVE
Shaw Ltd,-8.10646811518252,-34.9132552742958,Miss other room increase pretty difficult. Lay line cultural write if food appear.,COCKTAIL_BAR,ACTIVE
Snyder-Gibson,-8.088517,-34.8843,Something social value trade section. Rise newspaper trip go. Operation financial all.,WINERY,ACTIVE
Jackson-Weber,-8.12110047300887,-34.9056994915009,That particular military religious number her main. Reason realize whom at kind yeah voice. View significant certain across maybe officer.,WINERY,ACTIVE
Beltran-Ramos,-7.914542,-34.824959,Series address speech quality option keep resource least. Hundred price improve simply apply arm none.,CAFE,ACTIVE
White and Sons,-7.562335,-34.99021,Away edge everybody some financial probably community. Sure institution read approach kitchen must build.,FOOD_TRUCK,ACTIVE
Finley Ltd,-7.5618,-35.002079,Turn offer case structure push today another.,ROOFTOP_BAR,ACTIVE
Ruiz-Medina,-7.663618,-34.934387,Another loss while get camera window. Even project leave my sort.,CAFE,ACTIVE
Adams LLC,-7.60268479793778,-35.2300804853439,Effect pay her such safe physical later. Particular why environment.,FOOD_TRUCK,ACTIVE
"Martinez, Caldwell and Smith",-7.611712,-35.325008,Place billion stand relationship decision prepare. Customer budget detail rest kid player action. Require section window then him kind. Wind bad themselves represent occur.,WINERY,ACTIVE
Parker and Sons,-7.845045,-35.255991,Behind law too sit feel. Pick offer all already ever.,LOUNGE,ACTIVE
"Brown, Alvarez and Wilkins",-7.87869,-35.453091,Set along class fear of answer police. Research room none occur heavy movie dark of. Purpose simple business within test fall cause.,RESTAURANT,ACTIVE
Wilson PLC,-7.795881,-35.588473,Me he training ahead. Small all approach itself and establish always. Pass education nearly style think recognize.,RESTAURANT,ACTIVE
Contreras-Medina,-7.85583,-35.774628,Modern political he.,BAR,ACTIVE
Carroll-Palmer,-7.751224,-35.604786,Newspaper woman nation everybody fund hope amount.,RESTAURANT,ACTIVE
"Harrison, Chase and Villanueva",-7.23794772442189,-35.9052474796772,Plan piece attack hotel five management us. Central specific anything area take already participant.,FOOD_TRUCK,ACTIVE
Rodriguez Inc,-7.230583,-35.897145,However ask film eye something. Ten result attorney modern. Miss near laugh call approach education management.,WINERY,ACTIVE
Perez-Peterson,-7.227808,-35.884496,Daughter attorney determine data dog.,LOUNGE,ACTIVE
Watts and Sons,-7.222899,-35.890027,Chance assume professional any easy again. Star through form lot only. Eat medical fight rate nothing little president they.,COCKTAIL_BAR,ACTIVE
"Jackson, Davis and Moreno",-7.115218,-34.879635,Life feel myself deal stock. Spend shake if spend.,WINERY,ACTIVE
"Myers, Long and Wilson",-6.832318,-35.138178,Fire professor knowledge bag ready president. Minute trouble about work church author animal. Whether me now draw true by.,LOUNGE,ACTIVE
"Kemp, Jimenez and Brewer",-6.38095787299981,-35.1302121878325,Material then do its explain wife wonder. Right other natural point price when these.,SPORTS_BAR,ACTIVE
Orr Group,-7.066603,-36.360165,Against remain safe which mean. Especially play thousand kitchen line sense.,SPORTS_BAR,ACTIVE
Willis Group,-6.867887,-36.917473,Material choose budget budget thus size might. Country film build base prevent indeed.,RESTAURANT,ACTIVE
Valencia-Jackson,-7.026488,-37.275883,Foreign off full happen road. Hand hard blood.,WINERY,ACTIVE
"Boyd, Brown and Mitchell",-7.02586,-37.275711,Character raise else improve. My reduce within describe cell could seven rather. Report deep really it factor try.,LOUNGE,ACTIVE
Grant-Parrish,-6.456517,-37.094879,Tell thank imagine practice. Theory executive else southern. Dog stuff six someone word feel west money.,NIGHTCLUB,ACTIVE
Heath Group,-6.439379,-37.08689,Get enter couple action team now. Woman three long available. Magazine third up focus.,SPORTS_BAR,ACTIVE
Newman-Taylor,-6.039956,-37.021688,Live husband either whom until. Ever glass person opportunity machine create group.,BAR,ACTIVE
Valenzuela Group,-5.866109,-37.185309,State rather college so let. Charge recent box seat today easy. Instead a military sit buy task remain.,FOOD_TRUCK,ACTIVE
Davis Ltd,-5.643654,-37.264652,Night land organization. Most so star within. Reveal you leave happy majority sort thus.,SPORTS_BAR,ACTIVE
"Robinson, Morgan and Hawkins",-5.2984,-36.765306,Watch mouth war week. Threat place pay station per.,NIGHTCLUB,ACTIVE
"Hickman, Collins and Holloway",-5.579299,-36.936599,Site cup idea physical. Young let contain in.,CAFE,ACTIVE
Allen Ltd,-5.579265,-36.936823,Line animal worry describe. Although result first message TV service.,BAR,ACTIVE
"Taylor, Shields and Salinas",-5.152278,-36.595703,Hand high fly. Relate mission accept visit white back. Visit maintain simply parent.,BAR,ACTIVE
Barnett-Fuller,-5.152278,-36.5957,Current specific Republican cut him shake. Need arm some.,NIGHTCLUB,ACTIVE
Alexander-Miller,-5.255272,-36.356143,Watch raise can accept forward. Such hundred develop event piece let. Painting performance well budget plan.,FOOD_TRUCK,ACTIVE
"Rubio, Lewis and Ball",-5.170156,-36.42536,Film six big. Threat hand music whether various. Standard practice that sister find. Exist open simple from.,LOUNGE,ACTIVE
Wilson Ltd,-6.261593,-36.518154,Level word staff per play true trip fish. Only quite middle like bit heavy. Teacher modern much available fight. Learn indeed begin believe professor.,COCKTAIL_BAR,ACTIVE
Guerra and Sons,-6.265366,-36.5189,Popular TV husband individual left art along bad. Explain seem number real. Cover school tend analysis science standard since.,COCKTAIL_BAR,ACTIVE
Ford-Brooks,-6.230596,-36.018288,Sit project significant certainly stuff reason. Defense past play part.,COCKTAIL_BAR,ACTIVE
"Harrell, Bright and Tate",-6.201206,-35.803019,Outside them receive candidate question energy. Prevent relationship explain family major prepare when. Cost quickly daughter as media me.,BAR,ACTIVE
"Carpenter, Vargas and Heath",-5.856748,-35.35366,Break father along billion cultural board spring. Media letter so happy analysis.,NIGHTCLUB,ACTIVE
Taylor LLC,-5.80975553633085,-35.2089381068822,Deep sometimes clearly case article. Yes rise fear pretty network.,COCKTAIL_BAR,ACTIVE
Mccullough-Weber,-5.789551,-35.202367,Window against positive each. Why word manage laugh community above hundred. Per protect money say his.,NIGHTCLUB,ACTIVE
"Baker, Mueller and Hoover",-5.65228129949136,-35.4250361770392,Serious green science attention company part build. Front across doctor official consider production owner travel. Full worker certain have minute. Time here form.,ROOFTOP_BAR,ACTIVE
Phillips Ltd,-5.64346900779477,-35.4219754748067,Modern until inside matter. Civil couple left relate. Stuff room describe serve continue minute.,BREWERY,ACTIVE
Castillo and Sons,-5.535653,-35.811535,Must blue section same. Most billion society responsibility company official single.,FOOD_TRUCK,ACTIVE
"Watson, Johnson and Thomas",-5.53456277809975,-35.8121245354414,Professor great item every him. Market threat president language.,PUB,ACTIVE
Woods Group,-5.429318,-35.85516,Baby citizen heavy finish economy country. Before candidate mean ability. Require everything seat author for financial few or.,WINERY,ACTIVE
Logan-Walker,-4.955602,-37.131264,Spring yet discover. Boy least together soon address feeling really report.,WINERY,ACTIVE
"Hernandez, Massey and Robertson",-4.83497351368111,-37.2589690983296,Official reduce leave policy bank. Article certainly either including better success.,LOUNGE,ACTIVE
Lewis Ltd,-4.472699,-37.801638,Large cultural effect of main term. Be suddenly answer short say identify interview.,NIGHTCLUB,ACTIVE
Novak and Sons,-4.372474,-37.925804,Training issue report environmental. Arrive sing mother care improve.,PUB,ACTIVE
Lewis-Santiago,-4.394708,-37.860668,Great clearly day discover probably score.,RESTAURANT,ACTIVE
Welch Group,-4.236395,-38.083515,Me item grow. Suddenly brother pick voice pressure improve environmental.,ROOFTOP_BAR,ACTIVE
Erickson-Clark,-4.181251,-38.131474,Record quickly agreement seven. Benefit throughout society guess dinner. Four rule leader teach since.,WINERY,ACTIVE
Walters Group,-4.148957,-38.264865,Risk however item else prepare project. Face business painting treat specific police happy. Quite discuss student purpose design trip education.,PUB,ACTIVE
"Garcia, Mckay and Miller",-4.130762,-38.239437,Force indeed college whose language. Management ever music region even light. Dream might author agent democratic body.,ROOFTOP_BAR,ACTIVE
"Hill, Santiago and Cruz",-4.131133,-38.237386,Opportunity medical research imagine top question. Box not boy program star record industry. Score interview example ago fire.,PUB,ACTIVE
Kelly-Johnson,-4.026748,-38.304364,Those everyone view. Day a budget five front.,WINERY,ACTIVE
Werner-Thomas,-3.982005,-38.354332,Kitchen exactly billion cut thousand building station. Seven low above summer start. Student generation music give suggest culture off key.,COCKTAIL_BAR,ACTIVE
"Wright, Owens and Martin",-3.971906,-38.528419,Ground change both.,PUB,ACTIVE
Villanueva-Carroll,-3.976835,-38.611388,Way phone wife medical fish environment. West home off science food.,BAR,ACTIVE
Boone Ltd,-4.047693,-38.635139,Identify person teacher than poor which.,PUB,ACTIVE
"Gill, Bradshaw and Manning",-4.09981936402001,-38.4952569007874,Special information stand lay kid each animal. Nothing trip better. Who product pattern method.,LOUNGE,ACTIVE
"Hernandez, Oliver and Petersen",-4.177753,-38.473215,Reflect sit bank goal firm because.,LOUNGE,ACTIVE
"Parrish, Pope and Wood",-4.14470637960193,-38.3720563352108,By pull mouth lawyer control. Range word kitchen against need.,FOOD_TRUCK,ACTIVE
Jackson Group,-4.263917,-38.051777,College ball around best. Rest contain special fact just compare catch individual.,BREWERY,ACTIVE
Taylor PLC,-4.305607,-38.008038,Off physical bit large. Quality attention project how within woman. Rather south general food eye item trade. Possible own might sport.,BREWERY,ACTIVE
Grimes LLC,-4.595104,-38.21941,Throughout model soon party now thing avoid. Late region find federal popular.,WINERY,ACTIVE
Humphrey Ltd,-4.57093,-38.363869,Interest home pressure food laugh radio. Edge you shoulder must four. Capital common east. Street piece read charge prepare several.,RESTAURANT,ACTIVE
Stanley and Sons,-4.516438,-38.566902,Hot senior radio history center. Force look listen nothing everyone expect. Soon enjoy new.,COCKTAIL_BAR,ACTIVE
Sherman Group,-4.93815,-37.971095,Particular court kitchen challenge. Class ask wonder federal style head.,WINERY,ACTIVE
"Reed, Cantrell and Melton",-4.83310932753488,-37.7823297679424,Nice indeed hotel watch fund. Western once take phone size.,NIGHTCLUB,ACTIVE
Bradley-Smith,-4.684642,-37.844616,His himself material TV discuss by certainly. This realize need.,LOUNGE,ACTIVE
Henderson Group,-4.681518,-37.823036,Focus six word prevent. Statement really east religious physical trade. Crime that great top team.,WINERY,ACTIVE
Peterson Inc,-4.56608181684612,-37.7667796611786,Force newspaper statement half. Chance go message well remember.,COCKTAIL_BAR,ACTIVE
Davenport-Smith,-4.564736,-37.77153,Develop team increase system including fall. Than approach indicate number him. Man early collection after.,BREWERY,ACTIVE
Christensen-Avila,-4.70937011838434,-37.4945535510778,Executive contain single dog all. Pattern catch ahead peace do worker particularly.,BAR,ACTIVE
"Ferguson, Roach and Crawford",-5.078453,-37.619319,Single inside tend school case everything become. Change budget past piece approach ever discover indicate.,CAFE,ACTIVE
"Williams, Jackson and Cook",-5.079875,-37.45916,Stage stock everyone home fight. Above culture able high teacher.,BREWERY,ACTIVE
"Zuniga, Calhoun and Morris",-5.187159,-37.356132,Travel true foreign miss. Large truth interview stay where goal phone. Sure network character.,RESTAURANT,ACTIVE
Hanna LLC,-5.462694,-37.515306,Food ability child drug environment build.,BREWERY,ACTIVE
"Robinson, Hernandez and Smith",-5.783972,-37.559082,Audience everyone toward. Politics sense born civil suggest ten strategy will.,CAFE,ACTIVE
"Esparza, Brown and Flores",-5.858161,-37.311309,Loss law school run. Amount tax listen appear. Theory near structure according.,BREWERY,ACTIVE
Young Group,-6.099239,-37.635169,Imagine amount different style.,WINERY,ACTIVE
"Nelson, Carlson and Williams",-5.955107,-37.705987,Movement research identify enter home. Interview others course citizen national nice collection.,PUB,ACTIVE
"Wright, Gardner and Lozano",-6.107352,-37.901214,Study executive return group eat audience. Executive drive game return east difference item door. Send later PM coach.,PUB,ACTIVE
Smith Group,-5.982835,-37.814698,Tax from technology later sea. Perform purpose past PM. Tax room system already source trouble. Open owner fish.,CAFE,ACTIVE
"Valentine, Hayes and Williams",-5.663194,-37.79828,Wonder leader movie under prove. Friend ok student address teacher participant herself vote.,LOUNGE,ACTIVE
