name,latitude,longitude,description,type,status
"Young, Anderson and Sims",-6.025341,-37.984776,Necessary discuss then force character amount none. Energy general six arrive everyone decision result. Hospital heavy bank indeed soldier myself.,NIGHTCLUB,ACTIVE
"Mejia, Nelson and Morgan",-6.108528,-38.212418,Lawyer just do trouble business serve maintain.,FOOD_TRUCK,ACTIVE
"Johns, Smith and Sims",-6.05426247054467,-38.461629711112,Total sure song after top. Near off around away. Song term direction hard foot director.,RESTAURANT,ACTIVE
Mccarthy Group,-5.89737,-38.626289,Hold exactly woman perhaps add dream.,BREWERY,ACTIVE
"Stevens, Romero and Collins",-5.245799,-38.129425,The perhaps will. Determine life movement impact under fear. Break set sure brother.,PUB,ACTIVE
"Bishop, Nelson and Marshall",-5.14788,-38.095192,Myself image everything consumer meet it in. Build pass grow mention particularly season.,SPORTS_BAR,ACTIVE
"Cervantes, Johnson and Cooper",-5.103315,-38.369888,His when account ahead. Then Congress pass firm appear.,WINERY,ACTIVE
"Frazier, Rogers and Lowe",-5.109715,-38.367653,Talk teacher address prove floor political. Power fact American region shake.,RESTAURANT,ACTIVE
Sheppard-Edwards,-5.083028,-39.040359,Else worker product lawyer thank ok. Institution language activity indeed play rest discussion work. Ask idea only purpose bag site former.,SPORTS_BAR,ACTIVE
"Lucas, Garrett and Powers",-5.190382,-39.295771,Shoulder decide whether note agent security. Trade if one eye at if lose.,BREWERY,ACTIVE
"Cook, Mendoza and Garza",-5.30517522242705,-38.9209985733032,Top similar bad remember. Herself or why approach your.,ROOFTOP_BAR,ACTIVE
Pugh-Webster,-5.297834,-38.921914,Story service leave base attorney free. No college gun pressure.,BAR,ACTIVE
"Wood, Ross and Cox",-5.60556,-38.770111,Than save fire particularly. Attack single appear generation word. Cultural public century part scene allow to consumer. Left series modern treatment read should.,BAR,ACTIVE
Ross-Collier,-5.58704150455093,-39.3727925419808,Control attention indicate player forward old whom. Argue house economy effort wind. Treatment attention both provide though church seek.,NIGHTCLUB,ACTIVE
Hill Ltd,-5.526656,-39.491276,Production after then generation help art. Trouble daughter wait improve store.,PUB,ACTIVE
"Martinez, Obrien and Lozano",-5.803808,-39.417203,Great deep model control behavior worker. Big ever front rich. Doctor quality do painting rise realize edge.,NIGHTCLUB,ACTIVE
"Smith, Wheeler and Rice",-5.748071,-39.623947,Thousand choose young total. Republican green wait rather.,LOUNGE,ACTIVE
"Patton, Pitts and Schultz",-5.460664,-39.717289,Spring expect our free. Social fast its organization. Everybody until sure cost.,NIGHTCLUB,ACTIVE
"Humphrey, Brown and Blevins",-4.550684,-39.598039,Character contain church author rate computer. Magazine affect ask take who. Possible cold just trip specific.,CAFE,ACTIVE
Gutierrez-Mclaughlin,-4.929293,-39.169159,Simply floor how look form work notice important.,ROOFTOP_BAR,ACTIVE
"Gray, Green and Golden",-4.845272,-39.13446,Something dog own rise hour. Citizen explain life example apply. Marriage sister star candidate course personal kid.,BAR,ACTIVE
Becker Ltd,-4.969685,-39.013592,Everything while baby free operation reality certainly. Idea read hotel research add. Information past suddenly glass act people imagine.,COCKTAIL_BAR,ACTIVE
"Fox, Reyes and Harris",-4.228627,-39.191326,Least represent her involve let coach woman. Organization understand same recent compare available. Stage risk support office. Resource more employee approach.,BREWERY,ACTIVE
Jackson-Adams,-4.419226,-39.045132,Three book program wide store test. Also pick how dark yourself on. Care benefit section along them recently.,WINERY,ACTIVE
Sanchez-Martinez,-4.372464,-38.809104,Fine area cut seven dark relate ability. Authority room church term together worry. Reduce day follow Mr magazine.,LOUNGE,ACTIVE
Raymond Group,-4.31908546393279,-38.7413160502911,Interview guy film effort get. Turn whole view center save someone evening. Visit party standard above staff official.,PUB,ACTIVE
Preston-Rodriguez,-4.220332,-38.700745,Always film eat good fear between. Word certain you same chance. Animal truth offer as analysis environmental poor.,CAFE,ACTIVE
Mcdonald-Hardin,-4.22451406983983,-38.7299743294716,Candidate lot teach continue actually security Republican occur. Push seat it political though senior. During maybe article contain wear significant various.,SPORTS_BAR,ACTIVE
Trujillo-Jones,-4.33165192939925,-38.8804113864899,East foot education structure simply from listen. Risk move lot inside reality. Speech figure fire with.,BAR,ACTIVE
"Jennings, Garcia and Webb",-4.329278,-38.882862,Sort others home teacher south Democrat. Family bit generation many personal.,NIGHTCLUB,ACTIVE
Cooley LLC,-4.260411,-38.931732,Agent safe worry. Task road heavy at development coach even trip.,NIGHTCLUB,ACTIVE
"Ballard, Morgan and Chambers",-4.226835,-38.921185,Food there challenge commercial start outside. Art where expect do. Interest reason activity decide.,RESTAURANT,ACTIVE
Russell LLC,-4.208012,-38.97411,Memory thus here impact light boy. Force technology enter sell certainly. Read say order indicate challenge according.,PUB,ACTIVE
Simpson Inc,-4.077061,-38.949264,Upon challenge open positive. My say decade they process.,BREWERY,ACTIVE
Orr-Lindsey,-4.024768,-38.932518,Tv inside as end next receive. Sister discuss even western through for compare population. Once green either financial respond.,COCKTAIL_BAR,ACTIVE
"Collier, Bradford and Guerrero",-4.10188874090294,-39.0580835938454,Positive relate smile participant during friend reason. Standard military control such rise. Interest billion along Democrat story itself network quality.,BREWERY,ACTIVE
"Rivera, Martinez and Mcpherson",-4.360537,-39.323832,Know citizen me analysis role. Good important because director few political.,ROOFTOP_BAR,ACTIVE
Sanders-Miller,-3.52406573838852,-39.6049772948027,Personal pattern line choice almost player man. Market recent ten life where between interview.,WINERY,ACTIVE
"Gonzalez, Hawkins and Serrano",-3.53175544838204,-39.597329646349,Become keep two. Trouble student step any doctor.,RESTAURANT,ACTIVE
"Brown, James and Brown",-3.498859,-39.579808,Rule support benefit well family. Project heavy attorney by.,PUB,ACTIVE
"Anderson, Garcia and Gardner",-3.5024,-39.578705,Recently feel everything everyone but as them onto. Painting hear give the science same. Result analysis past education business rule player.,LOUNGE,ACTIVE
Quinn-Gonzalez,-3.512973,-39.547285,Standard rather trip coach training Mr. Safe population mouth oil.,ROOFTOP_BAR,ACTIVE
Johnson-Mcintosh,-3.59966733993973,-39.4346322119236,Discussion sing everybody page give shake. Fight growth crime cell.,CAFE,ACTIVE
Mcintosh-Contreras,-3.67727721007864,-39.3485789000988,Wind without must. Compare take live what Mrs. All range production vote loss feeling.,NIGHTCLUB,ACTIVE
"Martinez, Cole and Roberts",-3.69879,-39.576592,Early amount moment possible strategy purpose serious. Just for fire gun herself each happy prevent. Push note impact executive see tough. Place customer concern mission record must whom.,ROOFTOP_BAR,ACTIVE
Brady-Hebert,-3.790701,-39.267433,Economy dark tree later sit. Data approach soldier that garden wife. Throughout trial white nation ok.,RESTAURANT,ACTIVE
"Anderson, Thomas and Walker",-3.67453,-39.234653,Develop these describe hear interview audience. Season recognize beat none. Everyone environment type hope.,NIGHTCLUB,ACTIVE
Weaver-Smith,-3.67460988779091,-39.1029462218285,Reach full on everyone check me inside. Common state along eye.,ROOFTOP_BAR,ACTIVE
"Smith, Williams and Campbell",-3.89560199987004,-38.686096072197,Society drive role. Whose provide let true ten thing. These mean where individual who.,SPORTS_BAR,ACTIVE
Little and Sons,-3.74362,-38.666755,Forward represent leave kind enough everything professor. Especially kind respond impact.,LOUNGE,ACTIVE
"Gomez, Moore and Lopez",-3.611849,-38.962582,Current meeting themselves. Situation conference around most.,LOUNGE,ACTIVE
Adams LLC,-3.578794,-38.830171,Human group check the from officer ever. Better daughter education its general book fast middle. Message similar believe happen away cultural third.,LOUNGE,ACTIVE
"Banks, Collins and Nunez",-3.64222966062507,-38.7038395553827,Community while standard college fast Republican. Back bed participant clearly hit economic. Avoid camera soldier lose he carry old point. Way herself court speak compare.,BAR,ACTIVE
Johnson-Jones,-3.61308796564943,-38.7625953555107,Question close yet design serious. Truth probably color red wear area reduce. Full tough rather blue way.,LOUNGE,ACTIVE
"Sanders, Scott and Hughes",-3.549862,-38.823143,Culture read government but late answer goal social. Six mean radio close summer boy nor money.,SPORTS_BAR,ACTIVE
Obrien-Hurst,-3.553664,-38.839767,House particularly better agreement. Agency rather under image. Pm particular hair often generation bag.,FOOD_TRUCK,ACTIVE
"Webb, Garcia and Ramirez",-3.552642,-38.893593,Ago true face other pattern issue. Five something test challenge begin area.,CAFE,ACTIVE
Brown-Carpenter,-3.514076,-38.896195,Garden clear kind future serious my statement coach. Before activity almost white. Evidence thousand score movie middle.,LOUNGE,ACTIVE
"Johnson, Marshall and Copeland",-3.44055,-39.148952,Individual sea camera. Administration performance drop deal. Increase leave answer.,BAR,ACTIVE
Taylor-Johnson,-3.532727,-39.074103,Partner since paper above miss himself. This team although word attack machine kind. Right deep bed letter.,BREWERY,ACTIVE
"Green, Fritz and Ward",-3.285605,-39.266636,Hope dark chance resource. Itself first sense brother expert early others.,ROOFTOP_BAR,ACTIVE
Conrad and Sons,-3.41782,-39.026821,Third letter enjoy environment. Notice team act ok lawyer. How call cup treat.,COCKTAIL_BAR,ACTIVE
Peck-Hall,-3.14201588416424,-39.7012853622437,Where herself care white again another phone. Live why consider nearly national region. Per cost before throughout free great.,NIGHTCLUB,ACTIVE
Gomez-Levy,-3.369875,-39.826653,Left fund different main cost interesting.,SPORTS_BAR,ACTIVE
Gray-Nelson,-2.926525,-39.906071,Challenge worry house identify single down check. Gas among firm. Hotel according second news in surface particularly college. Course author brother again before light major.,CAFE,ACTIVE
"Salazar, Ramos and Adams",-3.815675,-38.45472,Exist better either society strong. Travel begin available deep day. Structure concern participant food parent strong room.,NIGHTCLUB,ACTIVE
Webster PLC,-3.800805,-38.478532,Moment line father option. Wear need chair thing health guy high. Place relate word effort future section bag.,SPORTS_BAR,ACTIVE
Wright Ltd,-3.788054,-38.462461,Community particularly plan writer arrive. Add education special tonight. Appear win good white speech get.,FOOD_TRUCK,ACTIVE
Davis Inc,-3.777976,-38.481256,Media artist suggest third list language continue. Bank number hand dinner enjoy father treat.,PUB,ACTIVE
Fields-Walker,-3.76229,-38.479261,Practice do realize social list consider management. Performance not statement really if now morning.,COCKTAIL_BAR,ACTIVE
"Francis, Gomez and Jones",-3.74748425468617,-38.4745324775577,Establish history young you. Work drive price force upon instead early.,COCKTAIL_BAR,ACTIVE
"Thompson, Fisher and Williams",-3.745732,-38.477154,Source trade deal property. Nor thank simple learn skin mother detail. Key public somebody recent future.,LOUNGE,ACTIVE
"Velez, Schmitt and Williams",-3.738605,-38.457352,Party discuss ground take ground bar successful early. Medical if heart which especially sometimes senior just.,CAFE,ACTIVE
"Li, Bean and Ford",-3.740366,-38.453737,Benefit trouble few catch answer woman green first.,CAFE,ACTIVE
Tucker-Harris,-3.741678,-38.4535,Establish phone try carry. Family rest figure management today hundred Mr. Past game run.,LOUNGE,ACTIVE
"Russell, Roberson and Sutton",-3.73496,-38.458021,Keep however level anything return civil huge. Head off all week. Long difficult share kid treat American.,BREWERY,ACTIVE
"Huff, Phillips and Foster",-3.73540946012715,-38.4620329141944,Describe board consumer purpose again war cause. Necessary prepare author.,BAR,ACTIVE
Anderson and Sons,-3.724404,-38.481892,Year task food moment alone decision. Analysis cultural mission.,LOUNGE,ACTIVE
"English, Woods and Barton",-3.725708,-38.521601,Fund military whether place instead opportunity respond. Dinner skill tend culture certain step so.,LOUNGE,ACTIVE
"Vasquez, Nelson and Taylor",-3.72900401120211,-38.5156363248825,Market kitchen great society. Certainly language very music actually other shoulder.,SPORTS_BAR,ACTIVE
Brown-Lewis,-3.735559,-38.501655,Mind never bring yet employee whole certainly none. Read line sell hope when.,COCKTAIL_BAR,ACTIVE
"Barnes, Cooper and Meyer",-3.743228111728,-38.48795604,Be lead central main world. Choose those her indicate. Election house home concern agree unit. Toward shake deep put teacher growth.,WINERY,ACTIVE
"Mack, Gutierrez and Mills",-3.736509,-38.49971,Part source likely ok. Stock keep health simply big break child. Behavior little kid green son store same keep.,RESTAURANT,ACTIVE
Barrera and Sons,-3.743599,-38.501162,Actually writer tough ten word spring. Question second reveal consider. Environment north training create life knowledge.,PUB,ACTIVE
Thompson Inc,-3.768496,-38.493633,Social expect arm piece first TV side. Director feel offer create. Final what important laugh account.,BREWERY,ACTIVE
"Harper, Allen and Davis",-3.752171,-38.507385,Form other or who finish half result about. Size health responsibility subject left near. Improve sit lead bit body.,BREWERY,ACTIVE
"Hill, Benjamin and Farley",-3.75425590819375,-38.5210720896066,Food suggest worker expect avoid rule.,BAR,ACTIVE
Jenkins Inc,-3.753466,-38.51867,Environmental Mr main animal single bar. Know southern many story single spring watch.,CAFE,ACTIVE
Leach Ltd,-3.743324,-38.512518,Debate interview just admit him.,LOUNGE,ACTIVE
Hernandez Group,-3.740256,-38.541178,Where expert of those light market. Mother strong focus without reflect total.,CAFE,ACTIVE
Rowe-Delgado,-3.752851,-38.528507,Agency data account reason black recognize position safe. Civil check not identify generation clear involve upon. Situation laugh animal. It entire rest impact create area.,SPORTS_BAR,ACTIVE
Terry-Nguyen,-3.754619,-38.551791,Site case brother eye require yet. Improve student most.,BAR,ACTIVE
"Rodriguez, Richards and Castro",-3.730823,-38.583271,State decade relate business view put music. Evening next suffer now.,NIGHTCLUB,ACTIVE
"Floyd, Walker and Vaughan",-3.709104,-38.596607,Well protect to cut building individual. Option hospital room evidence sit view.,NIGHTCLUB,ACTIVE
Butler Ltd,-3.74362901454,-38.58522012,Whose bar food themselves establish represent. Staff rich nothing represent strong radio likely.,RESTAURANT,ACTIVE
"Bartlett, Beard and Peterson",-3.73737080508742,-38.5694092512131,International full report learn instead. Officer training natural might bit rather. Our window century.,CAFE,ACTIVE
"Peterson, Powell and Owens",-3.737409,-38.570398,South protect attention develop soldier air accept. Drug executive article our.,SPORTS_BAR,ACTIVE
"Watson, Hill and Martin",-3.779895,-38.57909,Respond society boy would performance easy small. Yeah military west summer sort up become quality. Sea dream subject goal prepare rule increase.,CAFE,ACTIVE
"Kemp, Caldwell and Price",-3.814735,-38.620964,Model practice direction political total with. Conference blue music lot it guy fire.,COCKTAIL_BAR,ACTIVE
"Rhodes, Thomas and Powell",-3.802849,-38.603174,Give religious wish audience poor. Pay project never fact win result what.,SPORTS_BAR,ACTIVE
Olson-Clark,-3.798339,-38.571401,Brother these notice bad truth better company. Everything away look get office himself. Where democratic same.,SPORTS_BAR,ACTIVE
Allen-Mcpherson,-3.801767,-38.537922,Child sort run. Child organization air goal newspaper.,NIGHTCLUB,ACTIVE
Brown LLC,-3.810338,-38.554775,Two in open. Try make tax. Much cover plant dark character student.,WINERY,ACTIVE
Anderson-Simmons,-3.78161632382977,-38.5519869625568,Yet eye improve car. We throughout himself. One same rule drive set it decide.,RESTAURANT,ACTIVE
Simpson-Hooper,-3.774786,-38.515199,Almost quickly goal try process grow kind. Only represent enter see space political her.,NIGHTCLUB,ACTIVE
Cooper-Schaefer,-3.807027,-38.498198,Would effort issue chance. Family evidence heart describe trade billion child own. Good approach town degree film.,CAFE,ACTIVE
"Montoya, Blackburn and Carter",-3.80289480142663,-38.4964406937934,Laugh mind three card tonight already situation.,ROOFTOP_BAR,ACTIVE
"Kennedy, Anderson and Rasmussen",-3.864976,-38.499091,Different long teacher trip choice father skill. Turn consumer child of nothing.,BAR,ACTIVE
"Allen, West and Molina",-3.831046,-38.611278,Write offer never tend return likely and. Speak range statement.,ROOFTOP_BAR,ACTIVE
"Richard, Villa and Harris",-3.875619,-38.600606,Smile eat good according change computer form. Democrat according its instead fish agency worker.,PUB,ACTIVE
Weber-Macias,-3.893331,-38.463539,Military environmental want me agree. Information little now agree development. Step research oil institution daughter.,RESTAURANT,ACTIVE
"Cameron, Moore and Wiley",-3.875345,-38.464315,First pick yet themselves avoid check. Course with easy modern water government specific. Report firm ask property large enjoy guy support.,LOUNGE,ACTIVE
"Davis, Hernandez and Terry",-3.859849,-38.464251,Language call serve economic director together. Trip while both government really resource. System season thousand because. Field half school window cultural.,COCKTAIL_BAR,ACTIVE
Perry-Sims,-3.903803,-38.391589,Station base deep trouble. Always owner cultural present marriage animal. Never live fall end friend.,RESTAURANT,ACTIVE
"Gray, Page and Ramsey",-3.859746,-38.385093,Across few around town finish color before. Too director five bank.,COCKTAIL_BAR,ACTIVE
Collins Ltd,-3.903461,-38.352716,Might full worry billion movie them. End ball cultural than reveal.,BREWERY,ACTIVE
"Werner, Adams and Davis",-3.923417,-38.324001,Sign discussion activity office miss thank perhaps. Teacher travel over its relate difference. Purpose outside any he staff range.,ROOFTOP_BAR,ACTIVE
Archer-Johnson,-3.948154,-38.350531,Quite site include security area. Year operation final significant clearly.,CAFE,ACTIVE
Allen Ltd,-2.82207903026688,-40.4119688272476,Occur game several do off. Level southern represent its forget kid wide.,LOUNGE,ACTIVE
Wright-Carey,-2.880809,-40.119482,Nature Mrs glass special environment. Voice right figure should allow.,WINERY,ACTIVE
Little-Randolph,-2.92026427010265,-40.1747569441795,This fire remain hold give. Growth total treatment according baby away. Show health trial fire drug box claim.,WINERY,ACTIVE
Benjamin Inc,-2.896169,-40.449361,Mention also authority this day manage maintain from. Set simply candidate recognize.,SPORTS_BAR,ACTIVE
"Barnett, Patel and Bradford",-3.125168,-40.150368,Edge protect billion gun whether. Do even administration rock inside. Environment pattern assume message past treatment whether buy.,RESTAURANT,ACTIVE
Burnett Inc,-3.601786,-40.45854,Usually represent turn image long. Treatment security prevent be exist product much may. Meeting grow social number choice.,WINERY,ACTIVE
Garcia Ltd,-3.670724,-40.350407,Executive film serve system. Trouble north program collection already whole Congress. Decision friend process coach.,CAFE,ACTIVE
Douglas-Roberts,-3.706449,-40.331878,Character glass room end skin. Tv staff western upon color.,RESTAURANT,ACTIVE
"Watson, Rice and Hines",-3.707026,-40.336425,Seek life medical top product. Concern play garden now according crime. Those speech project add floor coach network exactly.,LOUNGE,ACTIVE
Rogers Inc,-3.58319591852743,-40.546068817373,If those build teacher. Over face professional song part stand.,WINERY,ACTIVE
"Hayes, Keith and Ayala",-3.520424,-40.34674,Certain prove network standard particular measure audience. Door two young mind mind return. Material future popular everybody can.,ROOFTOP_BAR,ACTIVE
"Lawson, Hudson and Paul",-3.801421,-40.910035,Station whole company south few. Work manage build skill natural. Usually usually why think fact represent thousand.,LOUNGE,ACTIVE
Lyons PLC,-3.568926,-41.090114,Discussion serve bring during.,SPORTS_BAR,ACTIVE
Hall-Lamb,-3.720268,-40.991422,Enough fill art campaign team point star. Suffer care civil family.,NIGHTCLUB,ACTIVE
Pham-Allen,-3.4422918964849,-41.2020784020751,Color amount second because.,RESTAURANT,ACTIVE
Rogers PLC,-3.223535,-40.695012,Practice beyond for up cup cover. Situation attack medical state letter west.,BREWERY,ACTIVE
Bright Ltd,-3.122544,-40.833837,Run peace its tough nor discussion. The whether different political include throw. Result scene commercial know unit million. Education around PM young wall meeting.,COCKTAIL_BAR,ACTIVE
Hodge-Garcia,-2.91266972167834,-40.8500915765762,Full chair safe general. Early drop hotel. Stock measure beat hair.,RESTAURANT,ACTIVE
"Drake, Scott and Cherry",-3.019893,-41.136481,Apply reason significant admit meet. Out hot also specific student indeed particularly. Decision early such instead save they.,SPORTS_BAR,ACTIVE
"Lamb, Howell and Baker",-3.03187546967526,-41.2416806817055,Seem main lead. Center answer book option growth door.,SPORTS_BAR,ACTIVE
"Rivas, Norton and Obrien",-2.911352,-41.747955,Democrat until government morning study science. Want development serious senior.,ROOFTOP_BAR,ACTIVE
Robinson LLC,-2.902041,-41.779329,Really democratic off save art. Job way others agent.,COCKTAIL_BAR,ACTIVE
Mora-Black,-3.178889,-41.860001,Message record enough magazine.,FOOD_TRUCK,ACTIVE
"Phelps, Davis and Hernandez",-3.50732377623857,-42.194342315197,Body long floor ago. Enter end operation respond. Hospital training national. Mean in interesting report question.,PUB,ACTIVE
Harrell-Taylor,-3.739901,-42.311446,Travel word yard read by mouth. Go parent good reality section worker hope. Heavy exactly morning ask notice song century green.,COCKTAIL_BAR,ACTIVE
"Murray, Keller and Simpson",-3.71504713327877,-42.537978887558,But activity south while recent field. Knowledge reach employee improve bring manager. But feeling act maybe how.,ROOFTOP_BAR,ACTIVE
Thomas Group,-3.474111,-42.359417,Various different feeling visit perform. Relate computer century down approach success.,CAFE,ACTIVE
Harris Ltd,-3.396364,-42.389575,Same commercial involve information share. See place decision third new medical.,CAFE,ACTIVE
"Cook, Kelley and Ward",-3.116627,-42.412811,Gun development general. Card suddenly which lose education. Method hit also scene debate method.,WINERY,ACTIVE
"Henderson, Macias and Davis",-2.83846,-41.991947,Security blood environmental far. Present everybody food continue.,NIGHTCLUB,ACTIVE
Meyers Group,-2.789306,-42.302318,Property structure five home leave company. Draw ask leave discussion really sea.,WINERY,ACTIVE
"Stewart, Conner and Aguilar",-2.74519649726566,-42.8000944107771,Each tax success. Above charge realize west week piece. Impact movement son part budget.,ROOFTOP_BAR,ACTIVE
Duncan-Walker,-3.668011,-42.79678,They often itself fear. Article all trip race.,PUB,ACTIVE
Weber Ltd,-3.672243,-43.103934,Marriage election sometimes. Red check issue picture wide sell.,COCKTAIL_BAR,ACTIVE
Smith and Sons,-3.672243,-43.103934,Also positive police thousand party. Service write truth produce quickly yard. Age economic same run total past.,RESTAURANT,ACTIVE
"Ward, Phillips and Becker",-3.206992,-43.405273,Number manager live blue bank consumer. Hour accept at return green knowledge. Tell often billion shake across send finally.,NIGHTCLUB,ACTIVE
Johnson-Valentine,-3.332685,-43.530357,Threat direction standard difference write everyone. Join good focus particularly management station.,COCKTAIL_BAR,ACTIVE
Mcdowell-Middleton,-3.154753,-43.510874,Evidence reflect manager air. Mind nation worry kid modern something investment. Cut tree but process.,WINERY,ACTIVE
Smith Inc,-2.86417,-44.041555,Position act nor control. Development key involve agent.,ROOFTOP_BAR,ACTIVE
Cook LLC,-2.943094,-44.24692,Response study interview evidence early president. Population create trip government position audience. Recently cultural decide second success drug.,BREWERY,ACTIVE
Daniel LLC,-2.975861,-44.315723,Finally detail stuff help. Interview in appear imagine form.,NIGHTCLUB,ACTIVE
Henderson-Haney,-3.140713,-44.314096,Letter animal big east if beautiful people. Minute fly different information available. Image group let right.,COCKTAIL_BAR,ACTIVE
Castillo-Jackson,-2.929672,-44.055819,Make capital citizen thousand.,PUB,ACTIVE
Harris-Schwartz,-3.5425,-43.917167,Again population seem each successful thing career cut. Team build address might crime main wear. Husband often him animal.,COCKTAIL_BAR,ACTIVE
Ray-Swanson,-3.394228,-44.357431,Beat police main southern bed town hour. Level contain national music call may meet hand.,CAFE,ACTIVE
Johnson PLC,-3.574838,-44.579167,Arrive old a weight forward entire policy. Tell marriage order against inside boy staff interview. Ready quite another free. Decade teacher arm short lay surface.,SPORTS_BAR,ACTIVE
"Diaz, Porter and Hughes",-3.476044,-44.874895,Me significant five would great per. Might special quickly find inside organization.,SPORTS_BAR,ACTIVE
Campbell Inc,-3.210851,-44.997792,Police seat recognize rather agency success administration.,BAR,ACTIVE
Green-Jones,-2.993599,-44.996261,Never might center into today fear. Us bed fill hope.,WINERY,ACTIVE
"Barry, Kim and Grant",-2.889527,-44.880717,Vote whatever who indeed power against until. Law into baby ago sure friend sister although.,CAFE,ACTIVE
